
1,"ゲームオブスローンズ最終章の撮影一年間を追ったドキュメンタリー。

もの凄い数の人が関わっていたんだな〜エキストラだけで300人超えるしその1人1人にメイクや衣装を担当する人がいたりインフラ担当や人…
>>続きを読む"
2,"ゲームオブスローンズファイナルシーズンの制作に焦点を当てたドキュメンタリー映画。

GOT本編はオールタイムベストドラマだし、あの作品に携わったスタッフには感謝しかないけど、それでも今作の出来はかな…
>>続きを読む"
3,"素晴らしいです
キット絶対いい人やん
失礼ですが欧米人の不真面目さを知ってるからこういう現場仕事の裏側は見てるとドキドキするし、どうやってとりまとめているのか謎😅"
4,"ちょっぴり今更…！また本編を最初から観たくなってしまった。

和気藹々とした本読みにほっこり。エミリア・クラークとヘアメイクさんの関係性も素敵。やっぱり彼女の豊かで愛らしい表情が大好き。どこかのイン…
>>続きを読む"
5,"以前（昨年？）、エミー賞授賞式をネット配信で見ていたら司会者の発言にびっくり。『ゲーム・オブ・スローンズ』シリーズ（'11〜'19）は通算で159個ノミネートされ、59個も受賞したのだそう。全部エミ…
>>続きを読む"
6,"終わって欲しい気持ちと終わって欲しくない気持ち。皆が口々に苦しさを語っていて、本当にこれ以上の作品を人類には作れないと確信した。予想より遥かに、それでも想像できないほどの苦労があって、締め切りや予算…
>>続きを読む"
7,"ゲームオブスローンズ最終章の裏側に密着したドキュメンタリー。
こんな素晴らしいドラマを作ってくれてありがとう😭😭"
8,"制作に携わるスタッフみんな愚痴ってた。
それほどまでに苦労して作られた本編ということ。"
9,"最終章を見終わって、ロス状態の時に見つけたドキュメンタリー。

最終章の撮影にかけた1年間の記録。

映画とかドラマってストーリーや舞台が壮大であればある程、もの凄い人数が個々の役割を担って、複雑に…
>>続きを読む
#おけい海外ドラマ#おけいドキュメンタリー"
10,"ほんっっっっっっとに最高！！！！！！！
最終章観たあとに見るべき。
なぜなら最終章の撮影一年を追ったドキュメント。

今まで観てきた作品でもゲーム・オブ・スローンズの圧倒的な世界観とスケールの大きさ…
>>続きを読む"
Review Number,Review Text
1,
2,"本編好きなら観ておけ！

↑これもわかりますし

本編の世界観が好きで
まだ興奮が冷めていないなら
逆に観ない方がいいかも

↑これもわかるなあ


アメリカイチのドラマといえば、
で有名な ""ゲー…
>>続きを読む
#ゲームオブスローンズ#GoT#ラストウォッチ"
3,"ビハインド観るたびに思うけどすごいたくさんの人が携わってるんだなって思う。
8-3のシーン暗すぎだろふざけんなよ😡って思ってたけど夜の王とか明るいところで映って　てるの観たら納得だよねあれじゃあゴム…
>>続きを読む"
4,"東京にきてからまだ一本も映画観てない、、というか引越しもあったけん、2ヶ月くらいみてないかも、やだやだやだ
はやくみてぇ

あ、GOTは人生の傑作でふ"
5,"ドキュメンタリーとして最高なのでは。
市井の人々を描ききったゲームオブスローンズにぴったりの内容。現場のインフラ管理してる口悪い姐さん最高だった。撮影が如何に過酷であったか物凄く伝わってくる。"
6,"あっちでも予算と納期が限られてると、労働時間とんでもないことになるんだね

エキストラにあんなにも手厚く対応してるのはすごいなとは思った。
ボルトン家ジャケット欲しい"
7,"特に何か物語において重要な役割を果たすわけではない市井の市民を丁寧に撮ってきたゲームオブスローンズ のドキュメンタリーとして素晴らしかった。ある人はセットに積もる雪の監修、ある人は撮影所近くの売店…
>>続きを読む"
8,"みんなで読み合わせするところ泣いたァ
エミリアクラーク、表情豊かでめちゃくちゃ可愛いね🥲"
9,メイキングを2時間観ることってなかなかないけど…凄かった。スケールがやばい。皆様ご苦労様でした。
10,"今更だけど観てみた☺️🐺！！
GOTのドキュメンタリー🎞️

大感動😭✨✨

役者たちの読み合わせとかすごい！

事前に台本を読まずに、読み合わせの時に初めて知る展開に涙したり驚くみんなの表情😢✨
…
>>続きを読む
#reeのドキュメンタリー作品"
Review Number,Review Text
1,あれだけ壮大なドラマだと裏側も大変。大好きな作品。またもう一周したくなった。
2,"GOTもう一周すると決意した
あの壮大な世界がこう作られていたのかあ〜と。GOTファンにはブッ刺さる"
3,"やっぱりゲームオブスローンズ はさいこーです

ゲースロ2週目観るかハウスオブドラゴン観るかどうしようかな…"
4,"生み出してくれた全ての人に感謝🙏

キースの人間性が好きすぎる"
5,"私の大好きな大好きなドラマ
ゲーム・オブ・スローンズ！！
何周目やろ？確実に3周は見てる😂😂
それの最終章の製作裏側のドキュメンタリー！！

かなり前に観たけど昨日ちょうど3週目を見終わった所やった…
>>続きを読む"
6,"暗いし寒いし労働時間過多_(:3 」∠)_
そりゃあんな大作作る裏方にとってGOTというドラマが人生にとって大きな思い出になるのは間違いないが、一瞬だって見逃したくないであろう子供の成長を側で観るこ…
>>続きを読む"
7,日付不明、過去一年以内に視聴。それほどの感動は無かった記憶。普通
8,"最終シーズンのスタッフやエキストラ視点中心のメイキング。DVD BOX収録。

大規模なドラマを仕切って作り上げていく過程をごく一部ですが見せてくれます。

インタビューでの皆さんの表情がキラキラし…
>>続きを読む"
9,良すぎて泣いた。ちゃんと負の側面もあるのも良い。良質なエンタメがそこにはあったな…
10,"ゲームオブスローンズ最終章制作のドキュメンタリー
話忘れたけど大学生くらい時間ないと見返せない"
Review Number,Review Text
1,"2023.07.06(75)
U-NEXT・字幕
初

約2ヶ月間、自宅では映画を見ずに集中して見てきたドラマ「ゲーム・オブ・スローンズ」が昨夜で終わった。長かった！面白かったし、先が読めなかったの…
>>続きを読む
#2023(strayGH)"
2,"紙と水で人工の雪を作ってる。雪屋。進行。エキストラ待機場のこと。アクション俳優。エキストラメイク室がホール。それぞれに時間潰すエキストラ。トイレが凍ってエキストラトイレ使えない。全員精神擦り切らして…
>>続きを読む"
3,"すげえええドラマが良すぎたせいとかではなくて裏側もすげえええええ
と言うか冬の王の中の人ってそうだったんだ…これ見て知った
みんな楽しそうでめちゃくちゃ良かった"
4,"ゲームオブスローンズ最終章のメイキング映像です。
これを見る為にまた第一章から最終章まで見返してたのでやっと見れた！

台本の読み合わせの所が印象的でしたね。
ジョン・スノウ役のキット・ハリントンは…
>>続きを読む"
5,"ドラマ2周目観終わったので見てみました。

キャストの人達がで台本読みながら皆んなで喜んだり泣いたりしてるシーンが良かったです。関わってる人の多さに驚きました。"
6,"ずーっと気になってましたが、ドラマの最終章を見終わったら、自動再生で続けて観ることが出来ました笑

これはドラマ版を全部観てからの方が絶対いいです！ネタバレがバンバン入ります😆

メンバー全員での台…
>>続きを読む"
7,"最近完走した『ゲーム・オブ・スローンズ』、その最終章製作に密着したドキュメンタリー

いわゆるメイキングは俳優の姿が写されることが多いが、ここでは裏方の姿が主
美術、メイク、衣裳等…
この世界観を作…
>>続きを読む"
8,"『ゲーム・オブ・スローンズ 最終章』制作の1年を追ったメイキング作品。

どんだけ大変なことか。常軌を逸した規模。みんな辛そうやけどよく頑張ったね！という気持ち。"
9,"『ゲームオブスローンズ最終章』の
メイキング映画。
私生のベストドラマ２位の本作
素晴らし過ぎて何度も目頭が熱くなって…
“壮大な”って言葉じゃ足りなかったよ。

台本の初読み合わせで
初めてデナー…
>>続きを読む"
10,"本当に本当にありがとう。

ゲームオブスローンズに関わる全ての人々、このドキュメンタリーを作ってくれた人々。



こういう舞台裏描く系って「これ本当にリアルな雰囲気なのかな？」って思うことも多い…
>>続きを読む"
Review Number,Review Text
1,"ゲースロの余韻が重すぎたので、なんとか昇華したい思いでみたラストウォッチ。
良かったです。

あのドラマが作り物で良かった〜〜！
実在してなくて良かった！
と思った笑(当たり前)

撮影現場の裏側が…
>>続きを読む"
2,"ロス者にはもってこいの裏側が見れる
みんな笑い合ってて良かった"
3,"キャストさんの仲の良さが伝わってきて、こちらまで暖かくなった。
個人的にはドラマ史上最高の作品だと思っているので、そんな作品の制作側を少しでも知れたのが嬉しい。"
4,"GOTの撮影裏側ドキュメンタリー。
わたしにもエキストラジャケットください、、、"
5,"世界的大ヒットコンテンツ〈ゲーム・オブ・スローンズー最終章ー〉の舞台裏に密着したドキュメント👑🪑⚔️

シナリオの漏洩を防ぐ為、出番のないキャストまでもが海外の撮影現場入りして、ヤジ馬たちの目をくら…
>>続きを読む"
6,"記録 2023/02/21_(11)
ゲームオブスローンズは
勤勉で優秀な人たちの手で作り上げた
魅惑的な世界よ"
7,"🤩「ゲーム・オブ・スローンズ」を愛する者ならば必見の制作過程の現場ドキュメンタリー🤩この刺繍タペストリーもじっくり見たい

想像していたよりも、実際に建設した規模の大きさに驚きました。まさか、あの街…
>>続きを読む
#旅人したい‼︎#♡トアマンド♡#映画の学校#こんなドキュメンタリーを観た"
8,
9,"ドラマ最終章制作の裏側についてのドキュメンタリー。めちゃくちゃ面白い。
メインキャストに限らずエキストラ、舞台、美術、メイク、演技指導、雪職人に至るまであらゆる分野のプロフェッショナルが力を合わせて…
>>続きを読む"
10,"色んな俳優の素顔や、名シーンの裏側、セットの作られ方とかもう本当最高…ご馳走様でした。ドラマ制作の裏側にはこんなにも多くの苦労があったなんて想像できなかったな。セットの規模がデカすぎてまじでテンショ…
>>続きを読む"
Review Number,Review Text
1,"ゲームオブスローンズ（GOT）最終章の裏側を記録したドキュメンタリー。めちゃくちゃ良かった！

GOTのドラマ好きすぎるのですが、そうじゃなくても単純にドキュメンタリーとして素晴らしかったです。何年…
>>続きを読む"
2,"どこまでが本物でどこからがCGなのかわからなかったので興味深かった。
夜の撮影、本当に大変だ…。
几帳面な雪職人のおじさんが好き。
ジョラーをちょこちょこ見られて嬉しい。
夜の王の素顔も素敵。
本読…
>>続きを読む"
3,"これを観るために8シーズン観たようなもん。
キャスト、エキストラ、美術担当などなどスタッフの作品への愛があってこそ、この大作が完結したんだな。絶対ハードだけど羨ましい。"
4,"超すげー👀👀👀
本読みで演者が死ぬシーンで泣いたり励ましてるのが凄かった。"
5,"キャストの裏側は少ないけれど見応えありました！
本当に大好きな作品の一つ。"
6,"本編を完走したので視聴したけど、こんなにも沢山の人々が関わっているのか、というあまりの規模の大きさと手間のかかり方に改めて脱帽した。最終章は特に規模が段違いだったので、完成させるためにさまざまな分野…
>>続きを読む"
7,映画の裏方のドキュメンタリーがあるからこそさらにその映画の世界が好きになる。一人一人が自分の役割を全うすることで凄い作品が作れることがよくわかった。
8,"やっと最終章のラスト回に辿り着き、その余韻のまま、このドキュメンタリー。

最高です。

ドラマの方をTV画面で、タブレットには相関図を広げ、見失ったら復習するスタイルで、観てきました。
興奮がまだ…
>>続きを読む"
9,
10,『ゲームオブスローンズ』最終章の舞台裏ドキュメンタリー。演者ではなくスタッフに焦点が当てられている。GoTに関わった全ての人達に敬意。最後の読み合わせのシーン泣けた。
Review Number,Review Text
1,"撮影現場ってなんであんなに楽しそうに見えるんだろうな...　わたしも台本のシュレッダー係やりたい（ほかにできそうなことが思いつかない）。

エキストラのお兄さんが映るか映らないかわからなくても演技し…
>>続きを読む"
2,"キャストよりスタッフに焦点を当てたドキュメンタリー。

出来れば最終回を見た後すぐに鑑賞したかったかな。"
3,"GOT最終章制作裏の中でも美術に特化したドキュメンタリーになっている。粗悪なクオリティは許されない大人気コンテンツ故の労力と、長期間撮影の疲労が伝わってくるが、クランクアップまで走りきれたのは作品へ…
>>続きを読む"
4,"このドキュメンタリーは2年前にザっと観たけど、全シリーズ再鑑賞したので、これもまた再鑑賞。シリーズの理解度が深まったから、さらに面白かった。

最初の方で、お馴染みのキャラクター達が出てくるんだけど…
>>続きを読む"
5,"ゲーム・オブ・スローンズの熱気が冷めやらず視聴。ゴールの先を観たい気持ちと終わらないで欲しい気持ちが同時に存在する。これほどまでの大作なら当然か。
数え切れない人たちの血と汗と涙と命と神経と人生を削…
>>続きを読む"
6,"ゲームオブスローンズ最終シーズンの撮影を1年間追った密着ドキュメンタリー。ハウスオブザドラゴン見てたら関連で出てきて知った。もっと早く見たかった‥

俳優陣も登場するけど、メインは現場監督や美術、エ…
>>続きを読む"
7,"もう終わってほしいという想いと、
終わらないでほしいという想いが混ざった複雑な感情。

え？そんな所まで？
と思うほど細部までこだわり抜いた裏側。

想像を遥かに超えた関係者の数。
あの人達全員のお…
>>続きを読む"
8,"エモエモだった。
ほんとうに作品のスケールがすごい。
こんな作品いつかやってみたい！"
9,"非常に良かった！！！
私こういう裏側見るの大好き！！！！
まじで感謝しかないな...

衣装とかセットとか、セリフの読み合わせとか
細かいところを見れるの嬉しいな...
というか、キャストだけでもと…
>>続きを読む"
10,"キャストが全然出てこないスタッフたちの戦いのドキュメンタリー
大変な思いをしながら弱音を吐きながらも作品に向き合う姿をみせてもらえてよかった
普通に口が悪いのもよかった、特にロケ現場担当の女性スタッ…
>>続きを読む"
